,,,,,,,,,,,,,,,AVERAGE,,,MOD1,,,SUBJ,,,VERB,,,MOD2,,,OBJ,,,,,,,,,,,,,,,,AVERAGE,,,MOD1,,,SUBJ,,,VERB,,,MOD2,,,OBJ,,,,Item,Base,Auditory Image,Visual Image,Metaphor,Valence %Pos,Valence RT,Interp,Fam,Natur,Image,Fig,#chars,#words,#content words,KF freq,Subt freq,con,KF freq,Subt freq,con,KF freq,Subt freq,con,KF freq,Subt freq,con,KF freq,Subt freq,con,KF freq,Subt freq,con,,Item,Literal,Valence %Pos,Valence RT,Interp,Fam,Natur,Image,Fig,#chars,#words,#content words,KF freq,Subt freq,con,KF freq,Subt freq,con,KF freq,Subt freq,con,KF freq,Subt freq,con,KF freq,Subt freq,con,KF freq,Subt freq,con,,PMM01,balloon,1.11,5.00,The kid's courage ballooned during the fight.,0.63,1842,0.95,3.89,4.30,3.70,5.70,45,7,4,48,141,473,61,339.2,536,32,23.67,277,0,0.06,623,,,,98,201.08,455,,PLM01,The mattress ballooned to its full size.,0.06,1647,n/a,4.32,4.65,5.35,3.40,40,7,4,92,55,499,,,,0,6.61,640,0,0.06,623,230,166.9,378,138,46.14,354,,PMM02,bounce,1.50,3.90,The friendly girl bounced through the party. ,0.95,1489,1.00,4.75,4.95,5.60,4.15,45,7,4,151,205,494,,26.04,,220,557.12,607,16,2.96,378,,,,216,233.14,496,,PLM02,The plane bounced down the dirt runway.,0.00,1498,n/a,5.11,4.94,6.00,2.61,39,7,4,44,32,502,,,,114,95.53,535,16,2.96,378,43,25.69,464,4,5.47,630,,PMM03,charge,1.65,2.55,The keen student charged through the test.,0.75,1573,1.00,4.42,4.85,4.25,4.15,42,7,4,80,37,439,11,4.47,336,131,43.04,549,58,14.45,350,,,,119,84.08,520,,PLM03,The hurt bull charged at the fighter.,0.00,1575,n/a,5.94,5.94,6.56,1.39,37,7,4,30,75,481,37,246.35,368,14,27.51,640,58,14.45,350,,,,9,12.78,567,,PMM04,coast,1.10,3.15,The athlete coasted through college.,0.45,1699,1.00,5.83,5.35,3.22,5.72,36,5,3,93,30,554,,,,9,4.61,545,3,0.06,562,,,,267,85.18,554,,PLM04,The car coasted without any gas.,0.20,1840,n/a,5.00,5.35,5.55,2.10,32,6,4,430,226,478,,,,274,483.06,572,3,0.06,562,1345,354.65,222,98,67.78,554,,PMM05,crawl,1.20,3.70,The banker crawled through the contract.,0.05,1637,1.00,2.42,2.85,2.90,6.40,40,6,4,28,14,474,,,,5,4.76,547,20,3.96,408,,,,60,32.35,467,,PLM05,The spider crawled along the edge. ,0.05,1176,n/a,6.53,6.80,6.65,1.05,35,6,3,33,13,489,,,,2,10.1,595,20,3.96,408,,,,78,23.51,465,,PMM06,creep,1.15,2.95,The oil bill crept into congress,,,0.75,4.26,4.25,2.55,5.90,32,6,4,100,42,490,93,41.08,581,143,118.45,528,11,1.14,465,,,,152,8.22,384,,PLM06,The children crept down the cellar stairs.,,,n/a,6.39,6.41,6.67,1.56,42,7,4,110,49,544,,,,355,175.1,582,11,1.14,465,26,9.37,572,47,9.37,558,,PMM07,dance,1.65,4.45,The paint danced over the canvas.,0.74,1411,0.89,5.11,4.41,4.28,6.11,33,6,3,22,17,575,,,,37,36.8,577,10,9.35,502,,,,19,4.24,645,,PLM07,The lady danced with the general.,0.45,1568,n/a,6.11,6.40,6.65,1.00,33,6,3,196,114,491,,,,80,217.08,564,10,9.35,502,,,,497,115.39,408,,PMM08,dart,1.30,3.75,The right words darted out of reach.,0.05,1462,1.00,4.50,4.24,1.78,6.50,36,7,4,250,1047,433,613,4008.39,361,274,122.02,395,6,0.04,608,,,,106,56.92,368,,PLM08,The small mouse darted out of view.,0.00,1453,n/a,6.22,6.18,6.44,1.44,35,7,4,186,46,503,542,124.96,402,10,19.12,624,6,0.04,608,,,,186,38.53,379,,PMM09,dive,1.70,4.15,The woman dove into her knitting ,0.33,1504,1.00,4.17,3.94,4.33,5.39,33,6,3,76,147,552,,,,224,434.63,580,4,5.57,494,,,,1,2.25,583,,PLM09,The woman dove into the pool.,0.40,1593,n/a,6.78,6.53,6.67,1.00,29,6,3,113,162,549,,,,224,434.63,580,4,5.57,494,,,,111,46.98,573,,PMM10,drift,1.15,2.65,The speaker drifted towards a conclusion. ,0.00,1527,1.00,4.75,5.10,3.45,4.35,42,6,4,39,6,402,,,,49,6.9,537,9,1.8,390,,,,59,9.12,278,,PLM10,The canoe drifted towards danger.,0.06,1208,n/a,6.11,6.37,6.45,1.75,33,6,3,29,16,450,,,,7,3.57,623,9,1.8,390,,,,70,43.67,338,,PMM11,flit,1.50,2.25,The model flitted between hair colors.,0.27,1475,1.00,3.28,3.24,4.00,4.61,38,6,4,92,49,474,,,,77,32.06,475,0,0.1,370,148,153.55,583,141,10.35,467,,PLM11,The butterfly flitted between flower blossoms.,0.83,1549,n/a,4.50,4.18,5.72,2.17,46,6,4,8,7,527,,,,2,5.51,593,0,0.1,370,23,22.76,584,7,1.31,559,,PMM12,flounder,1.30,3.05,The television show floundered in the spring.,0.00,1494,0.90,3.58,3.55,2.20,5.10,45,7,4,116,25,493,50,33.9,640,287,33.9,402,1,0.02,405,,,,127,31.31,524,,PLM12,The giant seal floundered on the beach.,0.05,1530,n/a,5.47,5.20,6.10,1.60,39,7,4,26,25,530,23,27.06,515,17,14.75,587,1,0.02,405,,,,61,56.63,612,,PMM13,fly,1.15,4.25,The sparks flew between the lovers.,0.95,1340,1.00,6.28,6.25,4.80,6.15,35,6,3,17,11,536,,,,5,5.02,526,27,15.39,525,,,,19,11.22,558,,PLM13,The crow flew into the nest. ,0.30,1360,n/a,6.00,5.82,6.67,1.00,29,6,3,16,10,557,,,,2,4.45,590,27,15.39,525,,,,20,11.1,557,,PMM14,hobble,1.25,3.40,The gambler hobbled through the card game.,0.06,1415,0.85,3.11,2.85,3.75,5.00,42,7,4,38,81,518,,,,1,4.59,511,2,0.14,520,26,85.43,565,123,233.84,477,,PLM14,The captain hobbled off the soccer field.,0.05,1375,n/a,6.11,6.35,6.50,1.15,41,7,4,91,73,554,,,,85,208.27,523,2,0.14,520,3,12.55,505,274,70.2,667,,PMM15,hop,1.65,3.85,The insults hopped on her tongue.,0.00,1233,1.00,2.37,2.10,2.50,6.50,33,6,3,15,12,500,,,,3,2.98,371,6,1.69,494,,,,35,31.16,634,,PLM15,The rabbits hopped in the yard.,0.45,1545,n/a,6.00,6.60,6.85,1.05,31,6,3,15,11,561,,,,5,6.43,635,6,1.69,494,,,,35,25.06,553PMM16,jump,1.30,4.05,The clever detective jumped at the clue.,0.72,1652,1.00,5.80,5.60,4.15,4.60,40,7,4,30,23,412,17,27.27,313,52,27.27,505,35,21.14,449,,,,15,17.61,380,,PLM16,The brilliant performer jumped onto the platform. ,0.82,1613,n/a,5.28,5.59,6.44,1.44,50,7,4,41,16,469,50,35.8,350,7,2.41,529,35,21.14,449,,,,72,6.14,547PMM17,leap,1.20,3.75,The celebrity leapt at the book deal.,0.44,1682,0.95,5.94,5.53,3.89,5.11,37,7,4,85,112,449,,,,3,7.29,455,2,0.88,389,193,176.98,609,142,261.37,342,,PLM17,The happy fan leapt during the goal.,0.95,1743,n/a,5.50,5.65,6.89,1.22,36,7,4,45,96,410,98,333.2,355,18,35.14,557,2,0.88,389,,,,60,16.75,340PMM18,lope,1.21,2.63,The rich loped through the recession.,0.00,2002,0.85,2.68,2.75,1.90,4.55,37,6,3,27,27,339,,,,74,80.39,377,1,0,426,,,,7,0.45,215,,PLM18,The wolf loped without concern.,0.22,1779,n/a,2.68,2.80,3.50,2.95,31,6,3,35,15,510,,,,6,20.27,595,1,0,426,,,,98,26.12,509PMM19,lumber,1.35,2.95,The bad news lumbered towards town.,0.00,1388,1.00,2.39,2.35,2.00,6.11,35,6,4,115,239,465,142,545.18,308,104,164.69,437,1,0.06,560,,,,212,247.92,556,,PLM19,The truck lumbered across the long bridge.,0.05,1584,n/a,4.89,4.70,5.80,3.05,42,7,4,228,198,540,,,,57,72.86,595,1,0.06,560,755,675.16,381,98,45.71,623PMM20,lurch,1.35,2.70,The football team lurched through the season.,0.10,1777,0.89,3.61,3.25,2.11,5.39,45,7,4,57,54,488,36,37.53,584,83,147.61,492,5,0.06,430,,,,105,31.47,445,,PLM20,The yellow taxi lurched through the lanes.,0.06,1310,n/a,4.00,4.70,5.90,3.05,42,6,4,20,15,534,55,33.8,537,16,25.84,632,5,0.06,430,,,,4,1.92,537PMM21,mosey,1.00,2.68,The friend mosied through the photographs.,0.40,1784,0.90,3.74,4.20,4.45,3.85,42,6,3,50,143,478,,,,133,419.29,450,0,0,395,,,,16,9.78,590,,PLM21,The tourists mosied without a clear plan.,0.18,1820,n/a,4.06,4.29,3.94,2.94,41,7,4,110,87,411,,,,16,5.41,533,0,0,395,219,171.82,359,205,171.82,357PMM22,plod,1.60,2.60,The surgeon plodded through the operation.,0.05,1686,0.85,3.63,3.90,4.60,3.80,42,6,3,42,20,515,,,,11,16.43,600,2,0,435,,,,113,43.94,510,,PLM22,The farmer plodded through the mud.,0.10,1614,n/a,5.89,5.55,6.20,1.80,35,6,3,19,9,561,,,,23,11.84,642,2,0,435,,,,32,14.82,605PMM23,plow,1.55,4.10,The student plowed through the history books. ,0.37,1738,1.00,5.53,5.70,5.45,5.65,46,7,4,130,49,513,,,,131,43.04,549,6,0.65,569,286,83.92,328,97,67.76,605,,PLM23,The broken tractor plowed over the hill.,0.06,1289,n/a,4.50,4.29,5.61,1.33,40,7,4,41,28,533,63,71.25,383,24,3.73,590,6,0.65,569,,,,72,37.55,588PMM24,pounce,1.50,3.85,The newspaper pounced on the story.,0.15,1855,1.00,5.00,5.70,3.55,6.05,35,6,3,73,82,521,,,,65,23.69,656,0,0.18,480,,,,153,220.78,427,,PLM24,The lion pounced on its prey.,0.00,1267,n/a,6.56,6.53,6.78,1.22,29,6,3,8,7,524,,,,17,15.35,627,0,0.18,480,,,,7,5.51,464PMM25,press,1.10,3.15,The lawyer pressed for a new trial.,0.10,1559,1.00,6.37,6.50,3.90,3.60,35,7,4,461,215,447,,,,43,79.51,569,30,5.82,425,1635,723.78,348,134,49.37,446,,PLM25,The heavy box pressed against his side.,0.06,1421,n/a,6.28,6.06,5.89,1.33,39,7,4,148,86,457,110,47.29,413,70,89.75,597,30,5.82,425,,,,380,200.92,394PMM26,puff,2.25,3.50,The coach puffed up the football team.,,,0.79,2.78,2.76,3.28,6.17,38,7,4,37,58,500,,,,24,47.63,561,4,0.82,363,36,37.53,584,83,147.61,492,,PLM26,The housewife puffed up the down pillows.,,,n/a,5.56,6.00,6.55,1.40,41,7,4,227,374,474,,,,4,3.53,580,4,0.82,363,895,1490.27,339,3,3.16,613PMM27,push,1.25,3.45,Their boss pushed for more sales.,0.11,1487,1.00,6.79,6.40,4.90,4.05,33,6,4,583,364,403,,,,20,124.29,552,53,20.49,412,2216,1298.59,284,44,12.71,364,,PLM27,His grandfather pushed against the refrigerator.,0.00,1795,n/a,4.61,5.41,6.39,1.22,48,6,3,29,18,517,,,,12,24.33,565,53,20.49,412,,,,23,8.37,574PMM28,race,1.35,3.65,The reader raced through the romance novel.,0.53,1770,1.00,5.84,5.75,4.70,4.50,43,7,4,41,8,428,78,,304,43,5.45,530,12,1.31,463,13,15.53,313,59,10.06,529,,PLM28,The runner raced past the empty lot.,0.00,1576,n/a,5.78,6.06,6.61,1.17,36,7,4,51,156,471,,,,1,4.96,605,12,1.31,463,64,47.24,374,127,569.92,443PMM29,reel,1.65,3.30,The colonel reeled in the officers.,0.16,1471,1.00,3.22,3.76,3.94,4.39,35,6,3,43,42,525,,,,37,96.25,523,2,0.06,502,,,,89,28.27,550,,PLM29,The fisherman reeled in a bass.,0.45,1634,n/a,6.16,6.70,6.50,1.05,31,6,3,8,4,539,,,,5,4.33,567,2,0.06,502,,,,16,7.55,547PMM30,retreat,1.05,2.95,The painter retreated from his gloomy marriage. ,0.05,1769,1.00,3.25,3.65,2.60,4.30,48,7,4,32,22,415,,,,21,6.75,568,8,1,367,3,2.41,327,95,77.06,398,,PLM30,The army retreated from the enemy lines. ,0.21,1349,n/a,6.50,6.83,6.33,1.06,41,7,4,107,43,455,,,,132,85.69,543,8,1,367,88,48.51,434,198,38.43,477PMM31,roll,1.50,3.75,The events rolled along at the picnic. ,0.50,1599,1.00,4.39,4.24,2.89,5.33,39,7,3,55,12,459,,,,101,16.86,379,48,8.47,457,,,,15,11.69,540,,PLM31,The ball rolled along the path.,0.16,1435,n/a,6.17,6.24,6.61,1.33,31,6,3,67,46,525,,,,110,104.96,615,48,8.47,457,,,,44,24.55,504,,PMM32,run,1.50,4.15,The guest ran through all the toilet paper.,0.05,1457,1.00,5.06,4.50,4.89,4.33,43,8,4,86,64,539,,,,39,39.94,519,134,84.24,451,13,28.9,586,157,103.35,599,,PLM32,The thief ran through the bank.,0.05,978,n/a,6.15,6.05,6.65,1.90,31,6,3,75,64,514,,,,8,24.27,519,134,84.24,451,,,,83,84.98,573,,PMM33,sail,1.30,4.45,The frank speaker sailed towards a finish. ,0.33,1945,0.89,2.78,3.24,2.94,5.78,43,7,4,42,67,462,68,159.39,401,49,6.9,537,10,3.65,567,,,,39,98.92,343,,PLM33,The boat sailed towards the sandy shore. ,0.47,1584,n/a,6.67,6.24,6.44,1.00,41,7,4,37,36,569,,,,72,95.78,637,10,3.65,567,6,24.25,499,61,19.86,574,,PMM34,sashay,1.35,3.20,The divorcee sashayed through the paperwork.,0.00,1388,0.89,2.72,2.53,2.44,5.33,44,6,3,1,4,488,,,,2,0.47,500,0,0.06,435,,,,0,10.41,530,,PLM34,The couple sashayed with much grace.,0.85,1541,n/a,3.89,4.24,4.50,2.89,36,6,4,275,310,368,,,,122,223.41,480,0,0.06,435,937,973.25,242,40,42.29,314,,PMM35,scurry,1.75,3.20,The promised money scurried out of sight.,0.05,1523,0.90,1.90,2.05,2.50,6.50,41,7,4,100,187,409,45,62.14,204,265,640.76,574,3,0.1,465,,,,86,45.31,393,,PLM35,The large rat scurried out of the way.,0.10,1398,n/a,6.47,6.70,6.50,1.05,38,8,4,320,375,417,361,41.45,314,6,32.61,624,3,0.1,465,,,,909,1424.73,265,,PMM36,shuffle,2.05,3.50,The ex-boyfriend shuffled out of her life.,0.17,1436,1.00,3.78,3.06,2.22,5.33,42,7,4,180,220,425,2,12.55,250,1,72.24,588,2,0.37,500,,,,715,796.65,361,,PLM36,The patient shuffled to the exit.,0.00,1324,n/a,5.89,6.15,5.95,2.05,33,6,3,32,27,471,,,,86,63.65,487,2,0.37,500,,,,7,15.57,425,,PMM37,sidle,1.20,2.70,The sad wife sidled up to the scotch. ,0.00,1172,0.95,2.78,2.82,3.67,4.39,38,8,4,68,107,476,35,63.37,360,228,348.92,562,2,0.02,398,,,,5,14.75,583,,PLM37,The gross man sidled up to the bar.,0.05,1255,n/a,4.95,4.60,5.70,2.55,35,8,4,339,487,464,66,15.27,273,1207,1845.75,618,2,0.02,398,,,,82,85.98,565,,PMM38,skulk,1.16,2.55,Her true opinion skulked behind her teeth.,0.00,1693,1.00,2.44,2.41,1.61,6.28,42,7,4,108,86,387,231,253.35,269,96,42,285,0,0,375,,,,103,47.84,618,,PLM38,The henchman skulked behind his cruel master.,0.05,1321,n/a,4.61,4.12,5.17,2.44,45,8,4,22,26,436,,,,1,0.33,503,0,0,375,15,18.35,367,72,87.25,498,,PMM39,sleepwalk,1.05,4.75,The teen sleepwalked through his school work.,0.06,1393,1.00,3.06,2.82,2.39,5.72,45,7,4,335,284,487,,,,6,4.1,515,0,0,540,573,333.12,492,760,798.02,402,,PLM39,The little boy sleepwalked into the basement.,0.00,1364,n/a,5.78,5.53,6.50,1.11,45,7,4,276,499,528,831,1446.39,378,242,529.82,609,0,0,540,,,,31,21.06,585,,PMM40,slide,1.40,3.40,The conversation slid into a wall. ,0.05,1396,1.00,2.47,3.30,2.35,6.50,35,6,3,78,41,519,,,,50,49.86,463,24,1.84,504,,,,160,70.69,589,,PLM40,The sleigh slid down the hill. ,0.33,1238,n/a,5.94,6.44,7.00,1.00,31,6,3,32,14,568,,,,0,3.27,613,24,1.84,504,,,,72,37.55,588,,PMM41,slink,1.35,2.75,The controversial film slinked out of the theaters.,0.06,1723,1.00,2.28,2.29,1.44,6.33,51,8,4,34,2,469,12,2.14,185,96,2.14,604,0,0.04,425,,,,29,1.8,660,,PLM41,The politician slinked out the back door.,0.05,1576,n/a,4.00,4.40,4.85,3.65,41,7,4,323,576,516,,,,13,3.27,494,0,0.04,425,967,2009.16,540,312,292.06,606,,PMM42,slither,1.75,3.60,The legend slithered across the internet.,0.00,1393,0.95,2.32,2.30,2.60,6.05,41,6,3,9,8,344,,,,26,17.16,265,0,0.18,338,,,,0,6.55,430,,PLM42,The snake slithered across the threshold.,0.05,1472,n/a,5.26,4.90,6.00,1.30,41,6,3,29,8,488,,,,44,22.35,621,0,0.18,338,,,,44,2.76,504,,PMM43,snake,1.30,4.70,The lies snaked through her story.,0.05,1457,1.00,3.84,3.70,2.75,6.25,34,6,3,66,86,468,,,,44,36.92,357,3,0.24,621,,,,152,220.78,427,,PLM43,The python snaked around its victim.,0.05,1238,n/a,4.79,5.45,6.25,1.55,36,6,3,15,17,583,,,,14,1.55,580,3,0.24,621,,,,27,47.73,549,,PMM44,sneak,1.15,2.65,The accountant snuck through the loophole. ,0.05,2007,0.95,4.05,4.70,2.45,5.70,43,6,3,2,4,390,,,,2,6.18,580,1,4.63,375,,,,2,1.02,215,,PLM44,The teenager snuck out the beer.,0.05,1594,n/a,5.65,6.35,6.72,1.11,32,6,3,12,29,521,,,,2,6.88,600,1,4.63,375,,,,34,75.49,587,,PMM45,spin,1.20,3.65,The debate spun into a brawl. ,0.00,1263,1.00,6.06,5.83,4.78,4.72,30,6,3,17,4,418,,,,32,9.29,375,17,1.69,424,,,,1,2.12,456,,PLM45,The top spun into the box.,0.20,1586,n/a,4.32,5.05,5.00,1.65,26,6,3,97,75,485,,,,204,133.43,435,17,1.69,424,,,,70,89.75,597,,PMM46,spring,1.55,3.55,The film script sprang to life.,0.84,1401,0.89,5.11,5.35,2.67,6.72,31,6,4,209,237,511,96,65.25,604,11,65.25,555,13,19.61,524,,,,715,796.65,361,,PLM46,The trout sprang out of the water.,0.26,1484,n/a,5.72,5.88,6.94,1.33,34,7,4,153,83,586,,,,4,4.02,617,13,19.61,524,,,,442,225.06,616,,PMM47,sprint,1.25,3.90,The nervous speaker sprinted through his talk.,0.06,1506,1.00,4.58,5.10,5.20,4.83,46,7,4,57,232,427,24,67.16,338,49,6.9,537,2,0,411,,,,154,855,422,,PLM47,The winner sprinted through the finish line.,0.80,1492,n/a,6.74,6.75,6.75,1.15,44,7,4,87,84,422,,,,8,31.22,455,2,0,411,39,98.92,343,298,206.18,477PMM48,stand,1.10,3.65,The brave worker stood up to the boss.,0.79,1712,0.95,6.58,6.65,5.60,4.05,38,8,4,72,48,454,24,31.71,283,30,10.94,532,212,25.78,450,,,,20,124.29,552,,PLM48,The famous lecturer stood at the podium.,0.33,1673,n/a,6.67,6.88,6.94,1.22,40,6,4,77,18,466,89,45.02,305,6,0.8,561,212,25.78,450,,,,1,1.27,546PMM49,stir,1.60,3.65,The minister stirred up the audience.,0.42,1702,1.00,6.58,6.70,6.55,4.60,37,6,3,64,15,543,,,,61,18.45,575,15,2.41,540,,,,115,25.37,515,,PLM49,The cook stirred up the stew.,0.32,1312,n/a,6.53,6.65,6.25,1.35,29,6,3,22,18,548,,,,47,45.57,502,15,2.41,540,,,,5,6.43,603PMM50,stomp,3.75,3.15,The rule book stomped on her plans.,0.06,1349,1.00,3.00,2.65,2.11,6.56,35,7,4,95,71,433,73,48.14,286,193,176.98,609,2,0.98,480,,,,113,56.22,357,,PLM50,The terrible giant stomped on their village. ,0.00,1162,n/a,5.74,6.00,6.55,2.05,45,7,4,36,39,459,45,94.02,263,23,27.06,515,2,0.98,480,,,,72,33.57,576PMM51,stream,1.60,4.30,The pictures streamed through her head.,0.37,1567,1.00,5.06,5.29,2.83,5.28,39,6,3,166,147,634,,,,69,68.18,675,4,0.16,624,,,,424,371.51,603,,PLM51,The tears streamed down her cheeks.,0.00,1292,n/a,6.89,6.76,6.94,1.50,35,6,3,18,9,564,,,,36,22.35,504,4,0.16,624,,,,13,4.41,565PMM52,strut,1.25,3.45,The actor strutted through middle age.,0.40,2016,0.90,2.35,2.55,2.00,5.55,38,6,4,93,49,412,,,,24,26.33,545,2,0.04,429,118,89.2,283,227,79.2,390,,PLM52,The vain shopper strutted with pride.,0.26,1598,n/a,4.94,4.94,5.50,2.83,37,6,4,14,9,378,10,6.51,315,1,0.65,497,2,0.04,429,,,,42,27.67,270PMM53,stumble,1.50,3.40,The hiker stumbled upon the cave.,0.35,1732,0.95,6.21,6.50,6.60,2.65,33,6,3,10,6,546,,,,0,0.27,614,21,3.98,433,,,,9,13.98,592,,PLM53,The drunk stumbled towards the shelter. ,0.00,1307,n/a,5.83,6.24,6.78,1.17,40,6,3,43,31,486,,,,37,76.55,465,21,3.98,433,,,,70,11.67,560PMM54,surf,1.80,4.55,The fat man surfed on the web.,0.05,1316,0.95,6.11,6.00,6.00,2.39,30,7,4,318,484,562,60,79.43,540,1207,1845.75,618,0,0.41,527,,,,6,9.22,561,,PLM54,The awkward woman surfed on the waves.,0.00,992,n/a,3.94,3.88,5.50,1.89,38,7,4,72,116,482,11,14.31,329,224,434.63,580,0,0.41,527,,,,51,13.22,492PMM55,swarm,2.20,4.30,The bright colors swarmed across the mural.,0.79,1748,0.95,4.16,4.20,5.45,5.65,43,7,4,36,23,465,87,44.41,473,51,44.41,467,3,0.35,406,,,,1,1.02,515,,PLM55,The bees swarmed towards the purple flowers.,0.22,1469,n/a,5.88,6.12,6.78,1.28,44,7,4,22,16,504,,,,15,5.33,597,3,0.35,406,13,12.33,427,58,47.59,584PMM56,sweep,2.20,4.15,The man swept away the woman,0.76,1601,1.00,5.53,5.60,4.30,5.30,28,6,3,489,762,558,,,,1207,1845.8,618,36,4.76,476,,,,224,434.63,580,,PLM56,The janitor swept away the dirt.,0.11,1321,n/a,6.74,6.75,6.60,1.05,32,6,3,28,12,524,,,,4,5.73,532,36,4.76,476,,,,43,25.69,564PMM57,swim,1.60,4.65,The pupil swam through the text.,0.50,1459,1.00,2.56,2.47,2.06,6.83,32,6,4,29,4,544,,,,20,3.14,570,6,2.41,482,,,,60,5.24,580,,PLM57,The whale swam through the channel.,0.11,1493,n/a,6.32,6.25,6.40,1.05,35,6,3,7,13,540,,,,0,11.25,610,6,2.41,482,,,,16,24.41,527PMM58,swing,1.55,4.00,Her mood swung throughout the night.,0.11,1896,1.00,4.33,4.18,2.06,5.78,36,6,3,165,301,413,,,,37,34.04,234,48,2.29,508,,,,411,866.04,496,,PLM58,The monkey swung through the branches.,0.40,1565,n/a,6.11,6.41,6.67,1.33,38,6,3,30,13,552,,,,9,33.51,566,48,2.29,508,,,,33,3.33,583PMM59,toss,1.55,3.70,The executive tossed out the old slogan.,0.10,1691,1.00,6.05,6.30,3.35,4.45,40,7,4,188,158,397,,,,55,10.61,457,31,8.25,365,660,608.94,349,7,2.49,415,,PLM59,The teacher tossed out the dirty blanket.,0.00,1254,n/a,5.79,5.80,5.65,1.45,41,7,4,44,36,491,,,,80,55.73,569,31,8.25,365,36,66.45,408,30,12.98,622PMM60,totter,1.10,2.60,The cake shop tottered on bankruptcy.,0.05,1525,1.00,3.79,4.45,2.85,5.25,37,6,4,21,25,496,13,45.06,624,63,53.55,549,0,0,479,,,,8,2.37,330,,PLM60,The model tottered in the high heels.,0.20,1645,n/a,5.11,5.12,6.11,1.89,37,7,4,149,59,476,,,,77,32.06,475,0,0,479,497,195,371,23,10,579PMM61,traipse,1.25,2.50,The artist traipsed through three marriages. ,,,0.84,2.94,3.24,1.89,5.56,45,6,4,174,144,450,,,,57,28.63,554,0,0.02,410,610,542.24,439,27,3.9,398,,PLM61,The secretary traipsed into the important meeting,,,n/a,3.84,4.16,4.70,2.37,49,7,4,180,93,407,,,,191,33.22,576,0,0.02,410,369,207.59,238,159,132.39,403PMM62,trudge,1.60,3.10,The case worker trudged through the files.,0.05,1577,0.95,5.33,4.94,5.06,4.33,42,7,4,102,80,493,362,282.41,548,30,10.94,532,4,0.02,410,,,,13,26.63,480,,PLM62,The park guide trudged through the swamp.,0.00,1341,n/a,5.78,5.88,6.28,1.50,41,7,4,35,25,507,94,72.12,579,36,17.84,468,4,0.02,410,,,,5,8.98,570PMM63,tug,1.30,3.50,The urgent letter tugged at her sleeve.,0.06,1861,0.95,2.50,2.41,2.67,6.67,39,7,4,45,26,465,21,14.86,230,145,82.61,577,2,0.2,465,,,,11,5.61,587,,PLM63,The puppy tugged at her trouser leg.,0.35,1434,n/a,5.94,6.47,6.83,1.33,36,7,4,17,3,570,,,,2,11.45,623,2,0.2,465,7,0.39,567,58,0.39,626PMM64,wade,1.40,4.10,The business waded into dark waters.,0.00,1432,1.00,3.22,2.94,1.67,6.72,36,6,4,156,105,501,,,,393,321,389,2,0.22,500,185,88.61,497,42,10.84,616,,PLM64,The dancer waded into the rough surf.,0.20,1625,n/a,3.16,4.20,4.80,2.05,37,7,4,19,15,509,,,,31,16.29,558,2,0.22,500,41,37.39,452,1,6.35,527PMM65,walk,1.47,3.85,The sister walked all over her brothers.,0.16,1666,1.00,5.72,5.41,3.00,6.50,40,7,3,80,94,537,,,,38,180.53,575,159,53.67,452,,,,44,47.06,585,,PLM65,The prophet walked up the mountain.,0.32,1456,n/a,6.00,6.00,7.00,1.17,35,6,3,66,31,506,,,,5,5.33,450,159,53.67,452,,,,33,35.39,616PMM66,waltz,2.15,4.45,The garlic tangoed with the ginger.,0.47,1724,0.95,2.50,2.53,2.33,6.50,35,6,3,2,4,559,,,,4,6.41,636,0,0.04,520,,,,2,6.41,522,,PLM66,The girl tangoed with the instructor.,0.40,1605,n/a,5.67,6.00,6.11,1.72,37,6,3,76,187,562,,,,220,557.12,607,0,0.04,520,,,,8,4.71,558PMM67,wander,1.05,2.30,The patient wandered through the magazine. ,0.11,1676,1.00,3.11,3.65,4.00,5.05,43,6,3,44,33,465,,,,86,63.53,487,8,3.45,320,,,,39,33.2,588,,PLM67,The group wandered through the marshes. ,0.17,1561,n/a,5.84,6.05,6.40,1.20,40,6,3,134,26,447,,,,390,73.76,451,8,3.45,320,,,,5,0.53,570PMM68,whirl,1.75,2.75,The letters whirled across the page.,0.25,1423,0.90,4.47,3.90,4.30,5.95,36,6,3,62,25,517,,,,115,37.45,577,6,0.04,402,,,,66,37.49,571,,PLM68,The clouds whirled across the sky.,0.56,1341,n/a,5.11,5.45,6.25,3.70,34,6,3,31,18,499,,,,28,10.02,554,6,0.04,402,,,,58,44.8,542PMM69,wiggle,1.30,3.50,The charming driver wiggled out of the fine. ,0.35,1951,1.00,4.26,4.85,4.65,5.40,45,8,4,59,168,419,24,28.12,386,49,47.37,553,3,0.2,409,,,,161,598.08,328,,PLM69,The black dog wiggled under the fence. ,0.15,1529,n/a,5.61,5.65,6.22,1.17,39,7,4,78,94,522,203,167.94,470,75,192.84,610,3,0.2,409,,,,30,16.06,597PMM70,worm,1.05,4.10,The news wormed through the family. ,0.00,1528,1.00,2.56,3.12,1.83,6.12,36,6,3,145,173,524,,,,104,164.69,437,0,0.22,611,,,,331,354.25,525,,PLM70,The mouse wormed through the opening.,0.06,1165,n/a,4.67,4.71,5.61,2.72,37,6,3,31,19,563,,,,10,19.12,624,0,0.22,611,,,,83,38.43,455,,,,,,,,,,,,,,,,,,,,,,,,,,,,,,,,,,,,,,,,,,,,,,,,,,,,,,,,,,,,,,,,,,,,,,,,,,,,,,,,,,,,,,,,,,,,,,,,,,,,,,,,,,,,,,,,,,,,,,,,,,,,,,,,,,,,,,,,,,,,253,,,339,,,,,,,,,,,,,,,,,,,,,,,,,,,,250,,,368,,,,,,,,,,,,,,,,,,,,,,,,,,,,,,,,634,,,,,,,,,,,,,,,,,,,,,,,,,,,,,,,586,,,,,,,,,,,,,,,,,,,,,,,,,,,,,,,,,,,,,,,,,,,,,,,,,,,,,,,,,,,,,,,,,,,,,,,,,,,,,,,,,,,,,,,,,,,,,,,,,,,,,,,,,,,,,,,,,,,,,,,,,,,,,,,,,,,,,,,,,,,,,,,,,,,,,,,,,,,,,,,,,,,,,,,,,,,,,,,,,,,,,,,,,,,,,,,,,,,,,,,,,,,,,,,,,,,,,,,,,,,,,,,,,,,,,,,,,,,,,,,,,,,,,,,,,,,,,,,,,,,,,,,,,,,,,,,,,,,,,,,,,,,,,,,,,,,,,,,,,,,,,,,,,,,,,,,,,,,,,,,,,,,,,,,,,,,,,,,,,,,,,,,,,,,,,,,,,,,,,,,,,,,,,,,,,,,,,,,,,,,,,,,,,,,,,,,,,,,,,,,,,,,,,,,,,,,,,,,,,,,,,,,,,,,,,,,,,,,,,,,,,,,,,,,,,,,,,,,,,,,,,,,,,,,,,,,,,,,,,,,,,,,,,,,,,,,,,,,,,,,,,,,,,,,,,,,,,,,,,,,,,,,,,,,,,,,,,,,,,,,,,,,,,,,,,,,,,,,,,,,,,,,,,,,,,,,,,,,,,,,,,,,,,,,,,,,,,,,,,,,,,,,,,,,,,,,,,,,,,,,,,,,,,,,,,,,,,,,,,,,,,,,,,,,,,,,,,,,,,,,,,,,,,,,,,,,,,,,,,,,,,,,,,,,,,,,,,,,,,,,,,,,,,,,,,,,,,,,,,,,,,,,,,,,,,,,,,,,,,,,,,,,,,,,,,,,,,,,,,,,,,,,,,,,,,,,,,,,,,,,,,,,,,,,,,,,,,,,,,,,,,,,,,,,,,,,,,,,,,,,,,,,,,,,,,,,,,,,,,,,,,,,,,,,,,,,,,,,,,,,,,,,,,,,,,,,,,,,,,,,,,,,,,,,,,,,,,,,,,,,,,,,,,,,,,,,,,,,,,,,,,,,,,,,,,,,,,,,,,,,,,,,,,,,,,,,,,,,,,,,,,,,,,,,,,,,,,,,,,,,,,,,,,,,,,,,,,,,,,,,,,,,,,,,,,,,,,,,,,,,,,,,,,,,,,,,,,,,,,,,,,,,,,,,,,,,,,,,,,,,,,,,,,,,,,,,,,,,,,,,,,,,,,,,,,,,,,,,,,,,,,,,,,,,,,,,,,,,,,,,,,,,,,,,,,,,,,,,,,,,,,,,,,,,,,,,,,,,,,,,,,,,,,,,,,,,,,,,,,,,,,,,,,,,,,,,,,,,,,,,,,,,,,,,,,,,,,,,,,,,,,,,,,,,,,,,,,,,,,,,,,,,,,,,,,,,,,,,,,,,,,,,,,,,,,,,,,,,,,,,,,,,,,,,,,,,,,,,,,,,,,,,,,,,,,,,,,,,,,,,,,,,,,,,,,,,,,,,,,,,,,,,,,,,,,,,,,,,,,,,,,,,,,,,,,,,,,,,,,,,,,,,,,,,,,,,,,,,,,,,,,,,,,,,,,,,,,,,,,,,,,,,,,,,,,,,,,,,,,,,,,,,,,,,,,,,,,,,,,,,,,,,,,,,,,,,,,,,,,,,,,,,,,,,,,,,,,,,,,,,,,,,,,,,,,,,,,,,,,,,,,,,,,,,,,,,,,,,,,,,,,,,,,,,,,,,,,,,,,,,,,,,,,,,,,,,,,,,,,,,,,,,,,,,,,,,,,,,,,,,,,,,,,,,,,,,,,,,,,,,,,,,,,,,,,,,,,,,,,,,,,,,,,,,,,,,,,,,,,,,,,,,,,,,,,,,,,,,,,,,,,,,,,,,,,,,,,,,,,,,,,,,,,,,,,,,,,,,,,,,,,,,,,,,,,,,,,,,,,,,,,,,,,,,,,,,,,,,,,,,,,,,,,,,,,,,,,,,,,,,,,,,,,,,,,,,,,,,,,,,,,,,,,,,,,,,,,,,,,,,,,,,,,,,,,,,,,,,,,,,,,,,,,,,,,,,,,,,,,,,,,,,,,,,,,,,,,,,,,,,,,,,,,,,,,,,,,,,,,,,,,,,,,,,,,,,,,,,,,,,,,,,,,,,,,,,,,,,,,,,,,,,,,,,,,,,,,,,,,,,,,,,,,,,,,,,,,,,,,,,,,,,,,,,,,,,,,,,,,,,,,,,,,,,,,,,,,,,,,,,,,,,,,,,,,,,,,,,,,,,,,,,,,,,,,,,,,,,,,,,,,,,,,,,,,,,,,,,,,,,,,,,,,,,,,,,,,,,,,,,,,,,,,,,,,,,,,,,,,,,,,,,,,,,,,,,,,,,,,,,,,,,,,,,,,,,,,,,,,,,,,,,,,,,,,,,,,,,,,,,,,,,,,,,,,,,,,,,,,,,,,,,,,,,,,,,,,,,,,,,,,,,,,,,,,,,,,,,,,,,,,,,,,,,,,,,,,,,,,,,,,,,,,,,,,,,,,,,,,,,,,,,,,,,,,,,,,,,,,,,,,,,,,,,,,,,,,,,,,,,,,,,,,,,,,,,,,,,,,,,,,,,,,,,,,,,,,,,,,,,,,,,,,,,,,,,,,,,,,,,,,,,,,,,,,,,,,,,,,,,,,,,,,,,,,,,,,,,,,,,,,,,,,,,,,,,,,,,,,,,,,,,,,,,,,,,,,,,,,,,,,,,,,,,,,,,,,,,,,,,,,,,,,,,,,,,,,,,,,,,,,,,,,,,,,,,,,,,,,,,,,,,,,,,,,,,,,,,,,,,,,,,,,,,,,,,,,,,,,,,,,,,,,,,,,,,,,,,,,,,,,,,,,,,,,,,,,,,,,,,,,,,,,,,,,,,,,,,,,,,,,,,,,,,,,,,,,,,,,,,,,,,,,,,,,,,,,,,,,,,,,,,,,,,,,,,,,,,,,,,,,,,,,,,,,,,,,,,,,,,,,,,,,,,,,,,,,,,,,,,,,,,,,,,,,,,,,,,,,,,,,,,,,,,,,,,,,,,,,,,,,,,,,,,,,,,,,,,,,,,,,,,,,,,,,,,,,,,,,,,,,,,,,,,,,,,,,,,,,,,,,,,,,,,,,,,,,,,,,,,,,,,,,,,,,,,,,,,,,,,,,,,,,,,,,,,,,,,,,,,,,,,,,,,,,,,,,,,,,,,,,,,,,,,,,,,,,,,,,,,,,,,,,,,,,,,,,,,,,,,,,,,,,,,,,,,,,,,,,,,,,,,,,,,,,,,,,,,,,,,,,,,,,,,,,,,,,,,,,,,,,,,,,,,,,,,,,,,,,,,,,,,,,,,,,,,,,,,,,,,,,,,,,,,,,,,,,,,,,,,,,,,,,,,,,,,,,,,,,,,,,,,,,,,,,,,,,,,,,,,,,,,,,,,,,,,,,,,,,,,,,,,,,,,,,,,,,,,,,,,,,,,,,,,,,,,,,,,,,,,,,,,,,,,,,,,,,,,,,,,,,,,,,,,,,,,,,,,,,,,,,,,,,,,,,,,,,,,,,,,,,,,,,,,,,,,,,,,,,,,,,,,,,,,,,,,,,,,,,,,,,,,,,,,,,,,,,,,,,,,,,,,,,,,,,,,,,,,,,,,,,,,,,,,,,,,,,,,,,,,,,,,,,,,,,,,,,,,,,,,,,,,,,,,,,,,,,,,,,,,,,,,,,,,,,,,,,,,,,,,,,,,,,,,,,,,,,,,,,,,,,,,,,,,,,,,,,,,,,